{
  "schemaVersion": "1.4.0",
  "generatedAt": "2026-06-14T16:27:57.272Z",
  "scanner": {
    "name": "idea-almanac",
    "version": "0.2.1"
  },
  "mode": "repo",
  "target": {
    "path": "/home/user/idea-almanac-private/packages/scanner/test/fixtures/sample-sfdx-repo"
  },
  "schedule": {
    "currentApiVersion": "67.0",
    "source": "built-in retirement-schedule.json"
  },
  "recommendedFloor": "64.0",
  "stalenessScore": 41,
  "stalenessBreakdown": {
    "formula": "round(100 × Σ tier_weight / total_items)",
    "totalItems": 10,
    "weightedSum": 4.05,
    "score": 41,
    "band": "high",
    "interpretation": "Significant version drift across many components. Upgrade effort will be substantial.",
    "contributions": [
      {
        "tier": "far-behind",
        "label": "Far behind — more than 9 releases from current",
        "count": 7,
        "weight": 0.6,
        "contribution": 3.6
      },
      {
        "tier": "behind",
        "label": "Behind — 4 to 9 releases from current",
        "count": 2,
        "weight": 0.15,
        "contribution": 0.45
      },
      {
        "tier": "current",
        "count": 1,
        "weight": 0,
        "contribution": 0
      }
    ]
  },
  "headlines": [],
  "summary": {
    "totalComponents": 10,
    "totalIntegrations": 0,
    "byTier": {
      "far-behind": 7,
      "behind": 2,
      "current": 1
    }
  },
  "components": [
    {
      "id": "force-app/main/default/classes/AncientHelper.cls-meta.xml",
      "type": "ApexClass",
      "name": "AncientHelper",
      "apiVersion": "28.0",
      "versionSource": "explicit",
      "location": "force-app/main/default/classes/AncientHelper.cls-meta.xml",
      "tier": "far-behind",
      "tierLabel": "Far behind — more than 9 releases from current",
      "severity": "critical"
    },
    {
      "id": "force-app/main/default/classes/LegacyService.cls-meta.xml",
      "type": "ApexClass",
      "name": "LegacyService",
      "apiVersion": "35.0",
      "versionSource": "explicit",
      "location": "force-app/main/default/classes/LegacyService.cls-meta.xml",
      "tier": "far-behind",
      "tierLabel": "Far behind — more than 9 releases from current",
      "severity": "critical"
    },
    {
      "id": "force-app/main/default/aura/legacyPanel/legacyPanel.cmp-meta.xml",
      "type": "Aura",
      "name": "legacyPanel",
      "apiVersion": "45.0",
      "versionSource": "explicit",
      "location": "force-app/main/default/aura/legacyPanel/legacyPanel.cmp-meta.xml",
      "tier": "far-behind",
      "tierLabel": "Far behind — more than 9 releases from current",
      "severity": "critical"
    },
    {
      "id": "manifest/package.xml",
      "type": "Manifest",
      "name": "package.xml",
      "apiVersion": "45.0",
      "versionSource": "explicit",
      "location": "manifest/package.xml",
      "tier": "far-behind",
      "tierLabel": "Far behind — more than 9 releases from current",
      "severity": "critical"
    },
    {
      "id": "force-app/main/default/triggers/AccountTrigger.trigger-meta.xml",
      "type": "ApexTrigger",
      "name": "AccountTrigger",
      "apiVersion": "52.0",
      "versionSource": "explicit",
      "location": "force-app/main/default/triggers/AccountTrigger.trigger-meta.xml",
      "tier": "far-behind",
      "tierLabel": "Far behind — more than 9 releases from current",
      "severity": "critical"
    },
    {
      "id": "force-app/main/default/lwc/orderList/orderList.js-meta.xml",
      "type": "LWC",
      "name": "orderList",
      "apiVersion": "55.0",
      "versionSource": "inherited",
      "location": "force-app/main/default/lwc/orderList/orderList.js-meta.xml",
      "tier": "far-behind",
      "tierLabel": "Far behind — more than 9 releases from current",
      "severity": "critical"
    },
    {
      "id": "sfdx-project.json",
      "type": "ProjectDefault",
      "name": "sfdx-project.json",
      "apiVersion": "55.0",
      "versionSource": "explicit",
      "location": "sfdx-project.json",
      "tier": "far-behind",
      "tierLabel": "Far behind — more than 9 releases from current",
      "severity": "critical"
    },
    {
      "id": "manifest/deploy/package.xml",
      "type": "Manifest",
      "name": "package.xml",
      "apiVersion": "60.0",
      "versionSource": "explicit",
      "location": "manifest/deploy/package.xml",
      "tier": "behind",
      "tierLabel": "Behind — 4 to 9 releases from current",
      "severity": "info"
    },
    {
      "id": "force-app/main/default/flows/Order_Fulfillment.flow-meta.xml",
      "type": "Flow",
      "name": "Order_Fulfillment",
      "apiVersion": "61.0",
      "versionSource": "explicit",
      "location": "force-app/main/default/flows/Order_Fulfillment.flow-meta.xml",
      "tier": "behind",
      "tierLabel": "Behind — 4 to 9 releases from current",
      "severity": "info"
    },
    {
      "id": "force-app/main/default/classes/ModernController.cls-meta.xml",
      "type": "ApexClass",
      "name": "ModernController",
      "apiVersion": "67.0",
      "versionSource": "explicit",
      "location": "force-app/main/default/classes/ModernController.cls-meta.xml",
      "tier": "current"
    }
  ],
  "integrations": [],
  "warnings": [
    {
      "code": "malformed-xml",
      "message": "Could not parse XML",
      "location": "force-app/main/default/pages/Broken.page-meta.xml"
    },
    {
      "code": "managed-excluded",
      "message": "1 managed/namespaced component excluded — upgrade these in the package, not here."
    }
  ]
}
